{
  "name": "Cardiogen",
  "aliases": [],
  "category": "Peptide",
  "defaultRoute": "subcutaneous",
  "routes": [
    {
      "route": "subcutaneous",
      "unit": "mg",
      "doses": {}
    }
  ],
  "effects": [
    "cardiac tissue bioregulation (claimed)"
  ],
  "tags": [
    "peptide",
    "bioregulator",
    "no-human-data"
  ],
  "peptideProfile": {
    "sequence": "AEDR (Ala-Glu-Asp-Arg)",
    "suppliedForm": "lyophilized_vial",
    "reconstitutionSolvent": "Bacteriostatic water",
    "storage": {
      "temperature": "refrigerate"
    }
  },
  "sources": [
    "Khavinson, Springer Adv Gerontol 2014"
  ]
}
