{
  "name": "Ranitidine",
  "aliases": [
    "Zantac (withdrawn)",
    "Taladine"
  ],
  "category": "Antihistamine",
  "defaultRoute": "oral",
  "routes": [
    {
      "route": "oral",
      "unit": "mg",
      "doses": {
        "threshold": 37.5,
        "light": {
          "lower": 75,
          "upper": 75
        },
        "common": {
          "lower": 150,
          "upper": 150
        },
        "strong": {
          "lower": 150,
          "upper": 300
        },
        "heavy": 300
      },
      "duration": {
        "onset": {
          "min": 60,
          "max": 120
        },
        "peak": {
          "min": 120,
          "max": 180
        },
        "offset": {
          "min": 480,
          "max": 720
        },
        "total": {
          "min": 720,
          "max": 960
        }
      }
    }
  ],
  "effects": [
    "Reduces gastric acid secretion",
    "GERD and peptic ulcer relief",
    "Withdrawn from US market in 2020 due to NDMA contamination concerns",
    "No significant CNS or anticholinergic effects"
  ],
  "halfLifeMinutes": 150,
  "sources": [
    "https://en.wikipedia.org/wiki/Ranitidine",
    "https://pubchem.ncbi.nlm.nih.gov/compound/3001055"
  ],
  "tags": [
    "antihistamine",
    "H2-antagonist",
    "acid-reducer",
    "non-sedating",
    "withdrawn-US"
  ]
}
