{
  "name": "J-147",
  "aliases": [],
  "category": "Nootropic",
  "defaultRoute": "oral",
  "routes": [],
  "effects": [
    "Curcumin-derived experimental neuroprotective",
    "ATP synthase inhibition mechanism in Salk research",
    "Phase I clinical trials"
  ],
  "sources": [
    "https://en.wikipedia.org/wiki/J147"
  ],
  "tags": [
    "nootropic",
    "research-chemical",
    "investigational",
    "neuroprotective"
  ]
}
