{
  "name": "HHC",
  "aliases": [
    "Hexahydrocannabinol",
    "9α-Hexahydrocannabinol",
    "9β-HHC"
  ],
  "category": "Cannabinoid",
  "defaultRoute": "inhalation",
  "routes": [
    {
      "route": "inhalation",
      "unit": "mg",
      "doses": {
        "threshold": 2,
        "light": {
          "lower": 5,
          "upper": 10
        },
        "common": {
          "lower": 10,
          "upper": 25
        },
        "strong": {
          "lower": 25,
          "upper": 50
        },
        "heavy": 50
      },
      "duration": {
        "onset": {
          "min": 1,
          "max": 5
        },
        "peak": {
          "min": 20,
          "max": 60
        },
        "offset": {
          "min": 120,
          "max": 240
        },
        "total": {
          "min": 180,
          "max": 360
        }
      }
    },
    {
      "route": "oral",
      "unit": "mg",
      "doses": {
        "threshold": 5,
        "light": {
          "lower": 10,
          "upper": 25
        },
        "common": {
          "lower": 25,
          "upper": 50
        },
        "strong": {
          "lower": 50,
          "upper": 100
        },
        "heavy": 100
      },
      "duration": {
        "onset": {
          "min": 30,
          "max": 120
        },
        "peak": {
          "min": 120,
          "max": 300
        },
        "offset": {
          "min": 300,
          "max": 480
        },
        "total": {
          "min": 420,
          "max": 660
        }
      }
    }
  ],
  "effects": [
    "Euphoria similar to Δ9-THC (~80% potency estimate)",
    "Relaxation and sedation",
    "Appetite stimulation",
    "Hydrogenated form of THC — more chemically stable",
    "9β-epimer more potent than 9α-epimer; commercial products are racemic mixtures",
    "May evade standard THC drug tests (unconfirmed)"
  ],
  "halfLifeMinutes": 1200,
  "sources": [
    "https://en.wikipedia.org/wiki/Hexahydrocannabinol",
    "https://pubchem.ncbi.nlm.nih.gov/compound/5315888"
  ],
  "tags": [
    "cannabinoid",
    "semi-synthetic",
    "CB1-partial-agonist",
    "psychoactive",
    "hydrogenated"
  ]
}
