{
  "name": "Salvinicin A",
  "aliases": [],
  "category": "Dysdelic",
  "defaultRoute": "inhalation",
  "routes": [],
  "effects": [
    "Rearranged diterpene from Salvia divinorum",
    "Weak kappa-opioid partial agonism reported"
  ],
  "sources": [
    "https://pubmed.ncbi.nlm.nih.gov/15670653/"
  ],
  "tags": [
    "kappa-opioid-partial-agonist",
    "salvinorin",
    "research-chemical",
    "no-human-data"
  ]
}
